,id,url,fullName,parkCode,description,latitude,longitude,latLong,states,directionsInfo,directionsUrl,weatherInfo,name,designation,relevanceScore,address_postalCode,address_city,address_stateCode,address_countryCode,address_provinceTerritoryCode,address_line1,address_type,address_line3,address_line2,images_credit,images_title,images_altText,images_caption,images_url,park_phoneNumber,park_emailAddress
177,99F1F4ED-5B14-4756-B0EB-FF251B1A12BD,https://www.nps.gov/gegr/index.htm,General Grant National Memorial,gegr,"The final resting place of President Ulysses S. Grant and his wife, Julia, is the largest mausoleum in North America. It testifies to a people’s gratitude for the man who ended the bloodiest conflict in American history as Commanding General of the Union Army and then, as President of the United States, strove to heal a nation after a civil war and make rights for all citizens a reality.",40.81332817,-73.96331542,"lat:40.81332817, long:-73.96331542",NY,"General Grant National Memorial is located in Riverside Park, on the upper west-side of Manhattan. The entrance to the mausoleum is between north-bound and south-bound Riverside Drive, near the intersection of West 122nd Street. The visitor center is located to the west, across south-bound Riverside Drive. Street parking is available but can be very hard to find. The area is well-served with both bus and subway, by the Metropolitan Transportation Authority of New York (http://www.mta.info/).",http://www.nps.gov/gegr/planyourvisit/directions.htm,http://forecast.weather.gov/MapClick.php?CityName=New+York&state=NY&site=OKX&lat=40.7198&lon=-73.993#.Vqj8OvkrJlZ,General Grant,National Memorial,1.0,10005,New York,NY,US,,26 Wall Street,Mailing,,C/O General Grant National Memorial,NPS Photo,U S Military Academy at West Point Colorguard,West Point Cadets in formal uniforms carrying three flags in front of the mausoleum,Visit the site on the Birthday Ceremony for U.S. Grant,https://www.nps.gov/common/uploads/structured_data/4AF3F057-98B9-6E88-D80E74F879E83ED1.jpg,(646) 670-7251,gegr_info@nps.gov
178,48C4BDA1-98A3-441A-87FF-BAAB3AA043AE,https://www.nps.gov/gero/index.htm,George Rogers Clark National Historical Park,gero,"The British flag would not be raised above Fort Sackville Feb. 25, 1779. At 10 A.M., the garrison surrendered to American Colonel George Rogers Clark. His American army, aided by French residents of the Illinois country, had marched through freezing floodwaters to gain this victory. The fort’s capture assured United States claims to the frontier, an area nearly as large as the original 13 states.",38.67912659,-87.53545212,"lat:38.67912659, long:-87.53545212",IN,"The George Rogers Clark National Historical Park is located within the city of Vincennes, Indiana. Evansville is approximately 50 miles to the south and Terre Haute is approximately 50 miles to the north. Highway 41 provides good roads from the north or south. Highway 50 provides access from the east and west. From Hwy 50 east and west or from Hwy 41 from the north use the 6th Street exit. On Hwy 41 from the South use the Willow Street exit. From there follow the blue directional signs for the park.",http://www.nps.gov/gero/planyourvisit/directions.htm,"The weather in the area is quite typical for the Midwest. The average temperature for the winter months is the mid-30s, but the summers can often be hot and humid with temperatures reaching into the 90s.",George Rogers Clark,National Historical Park,1.0,47591,Vincennes,IN,US,,401 S. 2nd Street,Mailing,,,NPS Photo,Father Gibault,Statue of a man wearing a cloak with trees in background,Father Gibault an often overlooked part of the park.,https://www.nps.gov/common/uploads/structured_data/B8E339A2-BD5E-9EC2-A2ADA3A7BFFB4A14.jpg,8128821776,GERO_Ranger_Activities@nps.gov
179,542D7CC3-B948-4891-9811-829661F30686,https://www.nps.gov/gewa/index.htm,George Washington Birthplace National Monument,gewa,George Washington Birthplace National Monument is located in the Northern Neck of Virginia. It encompasses 551 acres of land where seven generations of the Washington family lived and where George Washington was born in 1732. The park was also central to one of the earliest efforts to memorialize George Washington during the celebration of his bicentennial birth anniversary in 1932.,38.19362603,-76.92079458,"lat:38.19362603, long:-76.92079458",VA,"George Washington Birthplace is located two miles from Virginia State Highway 3 on Virginia State Route 204. The park is located 38 miles east of Fredericksburg, 11 miles west of Montross, and 10 miles west of Colonial Beach.",https://www.nps.gov/gewa/planyourvisit/directions.htm,George Washington Birthplace can be very warm and humid in the summer months and cold and dry in the winter. Spring and fall are the best seasons to visit.,George Washington Birthplace,National Monument,1.0,22443,Colonial Beach,VA,US,,1732 Popes Creek Road,Mailing,,,NPS Photo,Viewing the Park,Family of three standing in front of the Birthplace Monument,Visiting the park in the 1930's,https://www.nps.gov/common/uploads/structured_data/B29DD294-D6B9-8374-957C41FECB93708A.jpg,8042241732,GEWA_Superintendent@nps.gov
180,56A5A3B1-4F49-4517-86B8-AE2F272D0C42,https://www.nps.gov/gwca/index.htm,George Washington Carver National Monument,gwca,"The young child known as the ""Plant Doctor"" tended his secret garden while observing the day-to-day operations of a 19th century farm. Nature and nurture ultimately influenced George on his quest for education to becoming a renowned agricultural scientist, educator, and humanitarian.",36.9871322,-94.35522737,"lat:36.9871322, long:-94.35522737",MO,"From Interstate 44, drive south on either: Interstate 49: Exit at Diamond (exit 35), then drive five miles east on highway V, and drive ¾ mile south on Carver Road to the park entrance. Highway 59: In Diamond, turn west on highway V and drive for 2 miles, and drive ¾ mile south on Carver Road to the park entrance.",https://www.nps.gov/gwca/planyourvisit/directions.htm,George Washington Carver National Monument is located in southwestern Missouri just outside of Diamond and about 10 miles from Joplin. Summer temperatures generally range from 75-100 degrees with high humidity. Winter temperatures generally range from 0-50 degrees with periods of intermittent freezing.,George Washington Carver,National Monument,1.0,64840,Diamond,MO,US,,5646 Carver Road,Mailing,,,NPS Photo,George Washington Carver Bust,A cast concrete bust of George Washington Carver and prairie in the background.,"A cast concrete bust for George Washington Carver by Audrey Corwin, 1952.",https://www.nps.gov/common/uploads/structured_data/33D94E3D-9B90-2F77-2EB5639EE1997F6A.jpg,417.325.4151,gwca_interpretation@nps.gov
181,E6D5BB41-3251-469F-ABDA-7B43B966F0CF,https://www.nps.gov/gwmp/index.htm,George Washington Memorial Parkway,gwmp,"The George Washington Memorial Parkway was designed for recreational driving. It links sites that commemorate important episodes in American history and preserve habitat for local wildlife. The parkway and its associated trails provide a scenic place to play and rest in the busy Washington, DC metropolitan area.",38.9628,-77.1495,"lat:38.9628, long:-77.1495","DC,MD,VA","Directions to Parkway Headquarters From the south, take the George Washington Memorial Parkway north. Just past the CIA exit turn right into the parking lot for the US Park Police and parkway headquarters. Go through the chain link fence and take an immediate right. Follow the road down to a stop sign and turn right into the parking lot for the headquarters building.",http://www.nps.gov/gwmp/planyourvisit/directions.htm,"Summers on the parkway are generally hot and humid, with daytime highs frequently above 90 degrees Fahrenheit and scattered afternoon thunderstorms. Please carry water while participating in physical activity and be prepared to take shelter from lightning. Winters on the parkway are generally cold, with nighttime lows frequently near freezing and occasional snowfall. Please be alert for snowplows and icy spots on roadways. Weather during spring and fall is generally moderate, but can change quickly.",George Washington,Memorial Parkway,1.0,22101,McLean,VA,US,,George Washington Memorial Parkway Headquarters,Mailing,,700 George Washington Memorial Parkway,NPS,The Navy and Merchant Marine Memorial,The Navy and Merchant Marine Memorial,The Navy and Merchant Marine Memorial,https://www.nps.gov/common/uploads/structured_data/3C828FFF-1DD8-B71B-0BC324016E82FE46.jpg,7032892500,gwmp_superintendent@nps.gov
182,8C330DA3-6194-4034-8948-C6B6772B82A0,https://www.nps.gov/gett/index.htm,Gettysburg National Military Park,gett,"The Battle of Gettysburg was a turning point in the Civil War, the Union victory that ended General Robert E. Lee's second and most ambitious invasion of the North. Often referred to as the ""High Water Mark of the Rebellion"", Gettysburg was the Civil War's bloodiest battle and was also the inspiration for President Abraham Lincoln's immortal ""Gettysburg Address"".",39.81557366,-77.23246758,"lat:39.81557366, long:-77.23246758",PA,"Gettysburg National Military Park is located in Adams County, Pennsylvania. The museum and visitor center is located at 1195 Baltimore Pike (Route 97) with a back entrance from the Taneytown Road (State Rt. 134). From North or South, follow US 15 to Gettysburg and watch for signs to direct you to the National Park Service Museum and Visitor Center. From East or West, drive into Gettysburg on US Rt. 30, turn South on Baltimore Street (Rt. 97), and follow signs to the entrance of the visitor center.",http://www.nps.gov/gett/planyourvisit/directions.htm,https://www.nps.gov/gett/planyourvisit/weather.htm,Gettysburg,National Military Park,1.0,17325,Gettysburg,PA,US,,1195 Baltimore Pike,Mailing,,,NPS Photo,The view from Little Round Top,The view from Little Round Top,The view from Little Round Top.,https://www.nps.gov/common/uploads/structured_data/3C81933E-1DD8-B71B-0B1D3D82C99E2A6E.jpg,,GETT_Superintendent@nps.gov
183,1BB1F955-A830-4E85-A80F-5E940A143CE5,https://www.nps.gov/gicl/index.htm,Gila Cliff Dwellings National Monument,gicl,"For thousands of years, groups of nomads used the caves above Cliff Dweller Creek as temporary shelter. In the late 1200s, people of the agricultural Mogollon (Southern Ancestral Pueblo) culture made it a home. They built rooms, crafted pottery and raised children in the cliff dwellings for one or two generations. By approximately 1300, the Mogollon had moved on, leaving the walls behind.",33.22715258,-108.2706711,"lat:33.22715258, long:-108.2706711",NM,"Passenger vehicles can drive north of Silver City, New Mexico to the monument on NM Hwy 15. The 46 mile trip can take up to two hours due to the narrow and mountainous curving nature of the road. RVs and vehicles pulling trailers should NOT use NM Hwy 15. From Silver City, take US Highway 180 to Santa Clara. Turn left onto NM Hwy 152 and drive to San Lorenzo. At San Lorenzo, turn left onto NM Hwy 35 and follow it to its termination at NM Hwy 15. Turn right on NM Hwy 15 and follow signs to the park.",http://www.nps.gov/gicl/planyourvisit/directions.htm,"Weather is extremely variable. Summers are usually around 90° F. but approach 100° F. Winters have occasional snow or temperatures near 0° F. Thunderstorms are common in the summer and early fall, usually in the afternoon.",Gila Cliff Dwellings,National Monument,1.0,88049,Mimbres,NM,US,,26 Jim Bradford Trail,Mailing,,,NPS Photo/Janice Wei,Eroded Cliffs Along the Gila River,Eroded cliffs reflecting off a river,"As the first designated Wilderness Area, the Gila offers endless opportunites peaceful reflection.",https://www.nps.gov/common/uploads/structured_data/C17A9A3D-1DD8-B71B-0B76151956BDE7ED.jpg,575-536-9461,gicl_information@nps.gov
184,3682DBDE-6746-4979-86CC-2358C5B72661,https://www.nps.gov/glba/index.htm,Glacier Bay National Park & Preserve,glba,"Covering 3.3 million acres of rugged mountains, dynamic glaciers, temperate rainforest, wild coastlines and deep sheltered fjords, Glacier Bay National Park is a highlight of Alaska's Inside Passage and part of a 25-million acre World Heritage Site—one of the world’s largest international protected areas. From sea to summit, Glacier Bay offers limitless opportunities for adventure and inspiration.",58.80086718,-136.8407579,"lat:58.80086718, long:-136.8407579",AK,"Glacier Bay National Park and Preserve lies west of Juneau, Alaska, and can only be reached by plane or boat. The only road in the area merely connects the small town of Gustavus and its airfield to park headquarters at Bartlett Cove (10 miles). Alaska Airlines provides daily jet service from Juneau to Gustavus in the summer months. Year-round scheduled air service is also provided by a variety of small air taxis and charters. The Alaska Marine Highway ferries also provide regular service from Juneau.",http://www.nps.gov/glba/planyourvisit/directions.htm,"Summer temperatures average 50° to 60° F (10° to 15° C). Rain is the norm in lush southeast Alaska. It is best to be prepared to enjoy the park in any kind of weather, especially rain. Suggested clothing includes waterproof boots, rain gear, a hat, gloves, wool or pile layers or a warm coat. Good rain gear is essential here. April, May and June are usually the driest months of the year. September and October tend to be the wettest.",Glacier Bay,National Park & Preserve,1.0,99826,Gustavus,AK,US,,Glacier Bay National Park & Preserve,Mailing,,PO Box 140,NPS photo,Camping in the Glacier Bay backcountry,Camping in the Glacier Bay backcountry,Glacier Bay provides endless possibilities for wilderness camping.,https://www.nps.gov/common/uploads/structured_data/3C7A0EE5-1DD8-B71B-0BADF220CB5F20BE.jpg,9076972230,glba_administration@nps.gov
185,2B5178C6-2446-488C-AC31-47E3CEBF7159,https://www.nps.gov/glac/index.htm,Glacier National Park,glac,"A showcase of melting glaciers, alpine meadows, carved valleys, and spectacular lakes. With over 700 miles of trails, Glacier is a paradise for adventurous visitors seeking wilderness steeped in human history. Relive the days of old through historic chalets, lodges, and the famous Going-to-the-Sun Road.",48.68414678,-113.8009306,"lat:48.68414678, long:-113.8009306",MT,"Glacier National Park is located in the northwest corner of Montana along the spine of the Rocky Mountains. By car you can access Glacier via Highway 2, which runs along the southern boundary of the park. You can reach the east side of the park via Highway 89. The nearest airports are in Kalispell and Great Falls, Montana.",http://www.nps.gov/glac/planyourvisit/directions.htm,"Glacier's weather is highly variable and can be extreme. Expect warm, sunny summer days but be ready for any type of conditions. In the winter, temperatures can fall well below freezing and typically the park receives considerable amounts of snow. Glacier's geography, straddling the Continental Divide, sets the stage for clashes of two very different climates. Warm, wet Pacific air moves in from the west, and cold, dry Arctic air flows from the northeast. They meet at the Divide.",Glacier,National Park,1.0,59936,West Glacier,MT,US,,PO Box 128,Mailing,,,NPS Photo,Glacier's Night Sky,Silhouetted mountains and flowers against a night sky filled with stars and a milky band of light.,Glacier's dark sky is important to wildlife and people.,https://www.nps.gov/common/uploads/structured_data/8B6A7473-B676-45CC-5663F191736048A4.jpg,406-888-7800,glac_questions@nps.gov
186,F7EB51F0-240D-49BC-968C-792756A3B1A0,https://www.nps.gov/glca/index.htm,Glen Canyon National Recreation Area,glca,"Encompassing over 1.25 million acres, Glen Canyon National Recreation Area offers unparalleled opportunities for water-based & backcountry recreation. The recreation area stretches for hundreds of miles from Lees Ferry in Arizona to the Orange Cliffs of southern Utah, encompassing scenic vistas, geologic wonders, and a vast panorama of human history.",36.9357464677,-111.485594268,"lat:36.9357464677, long:-111.485594268","AZ,UT",There are multiple districts in Glen Canyon very far away from each other. Avoid a two hundred mile detour and make sure you know which district you are going to before you begin travelling here.,http://www.nps.gov/glca/planyourvisit/directions.htm,"The weather in Glen Canyon National Recreation Area is usually typical for the high deserts. Summers are extremely hot with little, if any, shade. Winters are moderately cold with night time lows often below freezing. Spring weather is highly variable and unpredictable with extended periods of winds. Fall weather is usually nice and mild, a great time to beat the heat (and the crowds!).",Glen Canyon,National Recreation Area,1.0,86040,Page,AZ,US,,PO Box 1507,Mailing,,,NPS Photo,Lonely Dell Ranch at Lees Ferry Historic District,Log cabin and fences with a wooden wagon.,Glen Canyon isn't just houseboats and wakeboards. Come down to Lees Ferry Historic District to relive pioneer times when crossing the river was a major undertaking.,https://www.nps.gov/common/uploads/structured_data/3C7F1D3F-1DD8-B71B-0BB2954FE3F5E82A.jpg,9286086200,glca_carl_hayden@nps.gov
187,3FBC6D2D-C61B-4399-BC35-1B00C92C406A,https://www.nps.gov/glec/index.htm,Glen Echo Park,glec,"Glen Echo Park began in 1891 as a National Chautauqua Assembly ""to promote liberal and practical education."" By 1911, it transformed into DC's premier amusement park until it closed in 1968. Since 1971, the National Park Service has owned and operated the site and today, with the help of the Glen Echo Park Partnership for Arts and Culture, offers year-round cultural and recreational activities.",38.96912315,-77.14012206,"lat:38.96912315, long:-77.14012206",MD,"By Car: Capital Beltway (I-495), Maryland outer loop exit 40 Cabin John Parkway to Clara Barton Parkway; Virginia inner loop exit 41 Clara Barton Parkway East; follow Clara Barton Parkway to MacArthur Boulevard and Glen Echo exit, left onto MacArthur Boulevard, straight across traffic circle at Goldsboro Road, next left onto Oxford Road, end of street, parking lots on the left. By Metro: Red Line to Bethesda or Friendship Heights Station, transfer to Montgomery County Ride-On Bus # 29, Glen Echo stop.",http://www.nps.gov/glec/planyourvisit/directions.htm,"Weather for Washington, D.C. and Bethesda, Maryland areas.",Glen Echo,Park,1.0,20812,Glen Echo,MD,US,,7300 MacArthur Boulevard,Mailing,,,NPS Photo/Bruce Douglas,Glen Echo Picnic area,people gathered at picnic tables enjoying a lunch in Glen Echo Park,"Glen Echo Park has a large picnic area with many tables, restrooms and a playground.",https://www.nps.gov/common/uploads/structured_data/3C84917B-1DD8-B71B-0B9EAFE7DD8C3A13.jpg,3013201400,gwmp_glen_echo@nps.gov
188,4A2954A3-F00F-46E4-8FC7-BB2766350518,https://www.nps.gov/glde/index.htm,Gloria Dei Church National Historic Site,glde,Before Pennsylvania there was New Sweden. Discover this last historic link to a forgotten past. Visit the church's pastoral surroundings and its burial ground of patriots and ordinary citizens alike.,39.93435005,-75.14398924,"lat:39.93435005, long:-75.14398924",PA,"The Gloria Dei Church is accessed from Christian Street in South Philadelphia. As in any city, use your street smarts and do not leave any valuables visible in your car. Several SEPTA bus routes serve the vicinity of the site. Visit the website for more information.",http://www.nps.gov/glde/planyourvisit/directions.htm,"Summers are typically hot and muggy, fall and spring are generally mild, and winter is cold. Snowfall is highly variable, with some winters bringing only light snow and others bringing several major snowstorms, with the normal seasonal snowfall standing at 22.4 in (57 cm). Precipitation is generally spread throughout the year, with eight to twelve wet days per month.",Gloria Dei Church,National Historic Site,1.0,19106,Philadelphia,PA,US,,c/o Independence National Historical Park,Mailing,,143 S. Third Street,Library of Congress Photo,The Gloria Dei Church c.1850,"A 19th century photograph of the Gloria Dei Church, with the cemetery in the foreground.","This 1850s photograph shows a bird's-eye view of the Gloria Dei Church, with the cemetery in the foreground and the masts of ships visible in the background.",https://www.nps.gov/common/uploads/structured_data/3C81E0A5-1DD8-B71B-0B23793CBA1F8C5C.jpg,215-389-1513,indevisitorinfo@nps.gov
189,0E797FA8-6E31-418B-A68F-13CEE37A2AF5,https://www.nps.gov/goga/index.htm,Golden Gate National Recreation Area,goga,"Experience a park so rich it supports 19 distinct ecosystems with over 2,000 plant and animal species. Go for a hike, enjoy a vista, have a picnic or learn about the centuries of overlapping history from California’s indigenous cultures, Spanish colonialism, the Mexican Republic, US military expansion and the growth of San Francisco. All of this and more awaits you, so get out and find your park.",37.85982543,-122.6007386,"lat:37.85982543, long:-122.6007386",CA,"Golden Gate National Recreation Area has many sites that span over 60 miles of mostly coastal areas north and south of San Francisco. Park areas can be reached by Highways 1, 101 and 280 from the north and south San Francisco Bay Area, and by Highway 80 from the East Bay. To access park headquarters at Fort Mason, please use the entrance at Franklin and Bay Streets in San Francisco.",http://www.nps.gov/goga/planyourvisit/directions.htm,"Winter is characterized by sporadic rain and cool weather punctuated by brilliant sunshine. In winter the grass greens. Trees and flowers dormant through winter start blooming in late February or early March and last until May or June. By July, summer fog predominates in most coastal areas of the park. Grasses and plants have now turned to the golden brown and muted grays characteristic of California summer and fall. September and October skies are clear and sunshine is abundant everywhere in the park.",Golden Gate,National Recreation Area,1.0,94123-0022,San Francisco,CA,US,,Golden Gate National Recreation Area,Mailing,,"Building 201, Fort Mason",NPS Photo,Golden Gate Bridge from Battery,Person jogging along a path with golden gate bridge in the background.,Golden Gate from Battery East,https://www.nps.gov/common/uploads/structured_data/FD457F81-C06F-457A-310C9781E0C97448.jpg,415-561-4700,goga_socialmedia_goga@nps.gov
190,8F858FBE-8E28-491A-BCBD-67E23D535EEA,https://www.nps.gov/gosp/index.htm,Golden Spike National Historical Park,gosp,"One of the greatest technological achievements of the 19th century is the completion of the first transcontinental railroad across the United States. Visitors to the park can see the location of the Last Spike Site, 1869 railroad construction features, walk or drive on the original railroad grade, and get an up close view of Victorian era replica locomotives.",41.61947508,-112.5242653,"lat:41.61947508, long:-112.5242653",UT,"Golden Spike National Historical Park is 32 miles west of Brigham City, Utah. Travelers on I-15: use exit 365 and drive west on Utah 13 and 83 through Corinne (follow brown directional signs) to Golden Spike Drive. Turn left and follow signs to the visitor center (8 miles). Southbound travelers on I-84: use Howell exit 26 and drive south on Utah 83 (follow brown directional signs) to Golden Spike Drive. Turn right and follow signs to the visitor center (8 miles). Lat/Long 41.617410,-112.550986",http://www.nps.gov/gosp/planyourvisit/directions.htm,"Golden Spike National Historical Park is located in a high desert environment in the Promontory Mountains near the north end of the Great Salt Lake. The temperatures can reach over 100 degrees in the summer and dip into single digits in the winter, with much of the park blanketed in snow. Visitors are recommended to check forecasts before coming to our site and come prepared for changing weather conditions.",Golden Spike,National Historical Park,1.0,84302,Brigham City,UT,US,,P. O. Box 897,Mailing,,,Courtesy NPS,View of Replica Locomotives Jupiter and 119 at the Last Spike Site,Sunset view of locomotives Jupiter and 119 at the Last Spike Site,View of Replica Locomotives at the Last Spike Site,https://www.nps.gov/common/uploads/structured_data/BDEADC4B-CBA8-5C6F-1E2F9C0E3AAC76FE.jpeg,4354712209,gosp_interpretation@nps.gov
