,id,url,fullName,parkCode,description,latitude,longitude,latLong,states,directionsInfo,directionsUrl,weatherInfo,name,designation,relevanceScore,address_postalCode,address_city,address_stateCode,address_countryCode,address_provinceTerritoryCode,address_line1,address_type,address_line3,address_line2,images_credit,images_title,images_altText,images_caption,images_url,park_phoneNumber,park_emailAddress
0,77E0D7F0-1942-494A-ACE2-9004D2BDC59E,https://www.nps.gov/abli/index.htm,Abraham Lincoln Birthplace National Historical Park,abli,"For over a century people from around the world have come to rural Central Kentucky to honor the humble beginnings of our 16th president, Abraham Lincoln. His early life on Kentucky's frontier shaped his character and prepared him to lead the nation through Civil War. Visit our country's first memorial to Lincoln, built with donations from young and old, and the site of his childhood home.",37.5858662,-85.67330523,"lat:37.5858662, long:-85.67330523",KY,The Birthplace Unit of the park is located approximately 2 miles south of the town of Hodgenville on U.S. Highway 31E South. The Boyhood Home Unit at Knob Creek is located approximately 10 miles northeast of the Birthplace Unit of the park.,http://www.nps.gov/abli/planyourvisit/directions.htm,"There are four distinct seasons in Central Kentucky. However, temperature and weather conditions can vary widely within those seasons. Spring and Fall are generally pleasant with frequent rain showers. Summer is usually hot and humid. Winter is moderately cold with mixed precipitation.",Abraham Lincoln Birthplace,National Historical Park,1.0,42748,Hodgenville,KY,US,,2995 Lincoln Farm Road,Mailing,,,NPS Photo,Statue of the Lincoln Family in the Visitor Center,Statue of the Lincoln family in the park's Visitor Center,Visitors to the park can view the statue of the Lincoln family.,https://www.nps.gov/common/uploads/structured_data/3C8614D1-1DD8-B71B-0B1AF72CA452B051.jpg,2703583137,ABLI_Administration@nps.gov
1,6DA17C86-088E-4B4D-B862-7C1BD5CF236B,https://www.nps.gov/acad/index.htm,Acadia National Park,acad,"Acadia National Park protects the natural beauty of the highest rocky headlands along the Atlantic coastline of the United States, an abundance of habitats, and a rich cultural heritage. At 4 million visits a year, it's one of the top 10 most-visited national parks in the United States. Visitors enjoy 27 miles of historic motor roads, 158 miles of hiking trails, and 45 miles of carriage roads.",44.409286,-68.247501,"lat:44.409286, long:-68.247501",ME,"From Boston take I-95 north to Augusta, Maine, then Route 3 east to Ellsworth, and on to Mount Desert Island. For an alternate route, continue on I-95 north to Bangor, Maine, then take I-395 to U.S. Route 1A east to Ellsworth. In Ellsworth, take Route 3 to Mount Desert Island.",http://www.nps.gov/acad/planyourvisit/directions.htm,"Located on Mount Desert Island in Maine, Acadia experiences all four seasons. Summer temperatures range from 45-90F (7-30C). Fall temperatures range from 30-70F (-1-21C). Typically the first frost is in mid-October and first snowfall begins in November and can continue through April with an average accumulation of 73 inches (185 cm). Winter temperatures range from 14-35F (-10 - 2C). Spring temperatures range from 30-70F (-1-21C).",Acadia,National Park,1.0,04609,Bar Harbor,ME,US,,PO Box 177,Mailing,,,NPS / Kristi Rugg,Climbing The Precipice,Two hikers ascend a sheer cliff trail by way of historic iron rung ladders.,"Whether it's a stroll along Ocean Path or a difficult ascent up The Precipice, there are hiking trails for everyone!",https://www.nps.gov/common/uploads/structured_data/3C7B48F9-1DD8-B71B-0BD3B413E58978F8.jpg,2072883338,acadia_information@nps.gov
2,E4C7784E-66A0-4D44-87D0-3E072F5FEF43,https://www.nps.gov/adam/index.htm,Adams National Historical Park,adam,"From the sweet little farm at the foot of Penn’s Hill to the gentleman’s country estate at Peace field, Adams National Historical Park is the story of “heroes, statesman, philosophers … and learned women” whose ideas and actions helped to transform thirteen disparate colonies into one united nation.",42.2553961,-71.01160356,"lat:42.2553961, long:-71.01160356",MA,"Traveling on U.S. Interstate 93, take exit 7 - Route 3 South to Braintree and Cape Cod. Take the first exit off Route 3 south - exit 42 - and follow signs toward Quincy Center. Continue straight on Burgin Parkway through six traffic lights. At the seventh traffic light, turn right onto Dimmock Street. Follow Dimmock Street one block and turn right onto Hancock Street. The National Park Service Visitor Center, located at 1250 Hancock Street on your left. Validated parking is in the garage to the rear.",http://www.nps.gov/adam/planyourvisit/directions.htm,"Be prepared for hot, humid weather. The historic homes are not air conditioned. While the visitor center remains open all year, the historic homes are generally closed from approximately November 1 through April 30th.",Adams,National Historical Park,1.0,02169,Quincy,MA,US,,135 Adams Street,Mailing,,,NPS Photo,The Gardens Located at Old House at Peace field,The gardens located at Old House at Peace field.,The gardens located by Old House at Peace field bloom in every color you can imagine.,https://www.nps.gov/common/uploads/structured_data/3C7C7D4E-1DD8-B71B-0B48B5CDE41703D7.jpg,617-773-1177,ADAM_Visitor_Center@nps.gov
3,1A47416F-DAA3-4137-9F30-14AF86B4E547,https://www.nps.gov/afam/index.htm,African American Civil War Memorial,afam,"Over 200,000 African-American soldiers and sailors served in the U.S. Army and Navy during the Civil War. Their service helped to end the war and free over four million slaves. The African American Civil War Memorial honors their service and sacrifice.",38.9166,-77.026,"lat:38.9166, long:-77.026",DC,"The memorial is located at the corner of Vermont Avenue, 10th St, and U Street NW, near the U Street/African-American Civil War Memorial/Cardozo Metro Station.",http://www.nps.gov/afam/planyourvisit/directions.htm,Washington DC gets to see all four seasons. Humidity will make the temps feel hotter in summer and colder in winter. Spring (March - May) Temp: Average high is 65.5 degrees with a low of 46.5 degrees Summer (June - August) Temp: Average high is 86 degrees with a low of 68.5 degrees Fall (September - November) Temp: Average high is 68 degrees with a low of 51.5 degrees Winter (December - February) Temp: Average high is 45 degrees with a low of 30 degrees (Source: www.usclimatedata.com),African American Civil War Memorial,,1.0,20242,Washington,DC,US,,1100 Ohio Drive SW,Mailing,,,NPS / Liz Macro,African American Civil War Memorial,Bronze statue of African American Civil War soldier.,African American Civil War Memorial,https://www.nps.gov/common/uploads/structured_data/1E29A16A-C551-66A4-9DABCD61403D61C7.jpg,2024266841,national_mall@nps.gov
4,E6E1D22A-7A89-47F8-813C-B611059A8CF9,https://www.nps.gov/afbg/index.htm,African Burial Ground National Monument,afbg,African Burial Ground is the oldest and largest known excavated burial ground in North America for both free and enslaved Africans. It protects the historic role slavery played in building New York,40.71452681,-74.00447358,"lat:40.71452681, long:-74.00447358",NY,The African Burial Ground National Monument is located on the first floor of the Ted Weiss Federal Building located at 290 Broadway in Lower Manhattan; close to Foley Square and just north of City Hall. Our visitor center is located mid-block on Broadway between the cross streets of Duane Street and Reade Streets.,http://www.nps.gov/afbg/planyourvisit/directions.htm,http://forecast.weather.gov/MapClick.php?CityName=New+York&state=NY&site=OKX&lat=40.7198&lon=-73.993#.Vqj8OvkrJlZ,African Burial Ground,National Monument,1.0,10005,New York,NY,US,,African Burial Ground NM,Mailing,26 Wall St,C/O Federal Hall National Memorial,NPS Photo,Exhibits within visitor center.,Exhibits within visitor center.,Exhibits within visitor center.,https://www.nps.gov/common/uploads/structured_data/7DF85D09-1DD8-B71B-0BAB5B558B9CEAA9.jpg,2122384367,african_burial_ground@nps.gov
5,64B9F127-31ED-43C9-882D-D7CD471AF314,https://www.nps.gov/agfo/index.htm,Agate Fossil Beds National Monument,agfo,"In the early 1900s, paleontologists unearthed the Age of Mammals when they found full skeletons of extinct Miocene mammals in the hills of Nebraska -- species previously only known through fragments. At the same time, an age of friendship began between rancher James Cook and Chief Red Cloud of the Lakota. These two unprecedented events are preserved and protected here... at Agate Fossil Beds.",42.42170419,-103.753886,"lat:42.42170419, long:-103.753886",NE,"From US 20: 22 miles south of Harrison, NE on State Hwy 29, then three miles east on River Road (paved) From US 26: 34 miles north of Mitchell, NE on State Hwy 29, then three miles east on River Road (paved). From State Hwy 71: 25 miles west on the unpaved portion of River Road.",http://www.nps.gov/agfo/planyourvisit/directions.htm,"Summers can be very warm, high 90's to 100 with the frequent afternoon thunderstorms. Plan to hike early and come down from the higher points if storms threaten. Winter temperatures can dip as low as -20 with snow and wind. Heaviest snows can be expected in late Spring.",Agate Fossil Beds,National Monument,1.0,69346,Harrison,NE,US,,301 River Road,Mailing,,,NPS Photo,The James H. Cook collection,This buckskin shirt decorated with quills was worn by Red Cloud.,Visitors agree that this shirt decorated with quillwork and worn by Red Cloud of the Oglala Lakota is a priceless piece of history.,https://www.nps.gov/common/uploads/structured_data/3C7A0A12-1DD8-B71B-0BC1CC6CDF2CFD4E.jpg,3086654113,agfo_ranger_activities@nps.gov
6,3B8307B3-54AB-4E5F-ACBC-8DECB98AD5F1,https://www.nps.gov/alka/index.htm,Ala Kahakai National Historic Trail,alka,"Established in 2000 to preserve, protect and interpret traditional Native Hawaiian culture and natural resources, Ala Kahakai National Historic Trail is a 175 mile corridor encompassing a network of culturally and historically significant trails. This ""trail by the sea"" traverses wahi pana (storied landscapes), ancient Hawaiian sites and over 200 ahupuaʻa (traditional land divisions). Connect now!",19.144668109,-155.890734294,"lat:19.144668109, long:-155.890734294",HI,"Open sections of the Ala Kahakai NHT can be accessed through the four Hawai'i Island National Parks: Hawaiʻi Volcanoes NP, Pu'uhonua o Hōnaunau NHP, Kaloko-Honokōhau NHP and Pu'ukoholā Heiau NHS. The Nā Ala Hele State Trails and Access Programʻs ""Ala Kahakai Trail"" in South Kohala is also open to the public. Additional sections of the trail are opened as they are sufficiently managed to protect the trail and associated areas.",http://home.nps.gov/alka/planyourvisit/directions.htm,"Hawaiʻiʻs coast is generally sunny and hot. Be prepared with sun protection (hat, mineral-based sunscreen, sunglasses and long sleeves) and water (minimum 2 liters of water per person per day for short hikes). Before visiting the Trail, check weather forecasts and follow all warnings and advisories: - https://www.weather.gov/hfo/ - www.hawaiicounty.gov/active-alerts",Ala Kahakai,National Historic Trail,1.0,96740,Kailua-Kona,HI,US,,Superintendent,Mailing,"73-4786 Kanalani Street, #14",Ala Kahakai National Historic Trail,NPS Photo,On the historic Kiholo-Puako Trail,"Trail stewards are greeted by the trail crew, who are performing traditional cultural protocol.","A group of people including men, women and children walk in a single file line away from the camera, on a wide, straight, historic trail that cuts through a rough ʻaʻa lava field. The trail appears as a light grey, against the darker lava lining it, the",https://www.nps.gov/common/uploads/structured_data/317D3E74-B539-A668-469F5AFB6CD52961.jpg,(808) 217-0307,aric_arakaki@nps.gov
7,C4E1A9A4-D121-4734-94FA-7788A93C2AAA,https://www.nps.gov/alag/index.htm,Alagnak Wild River,alag,"The headwaters of Alagnak Wild River lie within the rugged Aleutian Range of neighboring Katmai National Park and Preserve. Meandering west towards Bristol Bay and the Bering Sea, the Alagnak traverses the beautiful Alaska Peninsula, providing an unparalleled opportunity to experience the unique wilderness, wildlife, and cultural heritage of southwest Alaska.",59.05180188,-156.112002,"lat:59.05180188, long:-156.112002",AK,"Alagnak Wild River is located in a remote part of the Alaska Peninsula, about 290 miles southwest of Anchorage. Access is by boat or small floatplane.",http://www.nps.gov/alag/planyourvisit/directions.htm,"Located between the stormy north Pacific Ocean and the even stormier Bering Sea, the Alagnak Wild River is often a battleground between weather systems. When you visit, be prepared to encounter all types of weather.  On average, wet and cool conditions predominate in spring, summer, and fall. Winters are drier and colder.",Alagnak,Wild River,1.0,99613,King Salmon,AK,US,,PO Box 245,Mailing,,,NPS,Alagnak Wild River,aerial view of braided Alagnak River,Alagnak River's lower reaches are extremely braided.,https://www.nps.gov/common/uploads/structured_data/3C7E8391-1DD8-B71B-0BB3E18B7F96110A.jpg,9072463305,KATM_Visitor_Information@nps.gov
8,7D6098F9-3F75-4775-A56D-CD9C7F9A9488,https://www.nps.gov/anch/index.htm,Alaska Public Lands,anch,"Alaska’s parks, forests, and refuges are rich and varied. The Alaska Public Lands Information Centers help visitors and residents to have meaningful, safe, enjoyable experiences on public lands, and encourages them to sustain the natural and cultural resources of Alaska. These centers provide trip-planning, interpretation, and education for all ages.",61.2188,-149.894536,"lat:61.2188, long:-149.894536",AK,"Anchorage APLIC is located in downtown Anchorage on 4th Avenue, in the Federal Building. Fairbanks APLIC is located in downtown Fairbanks on the corner of Dunkel Street and Wendell Avenue, near the Chena River.",http://alaskacenters.gov/anchorage-directions.cfm,"Visitors center is located inside the Federal Building and weather conditions are seasonal conditions of the Anchorage area, outside the facility.",Alaska Public Lands,,1.0,99501,Anchorage,AK,US,,605 West 4th Avenue,Mailing,,Suite 105,NPS/Josh Spice,Fairbanks APLIC,"Fairbanks Alaska Public Lands Information Center, located inside the Morris Thompson Cultural & Visi","Fairbanks Alaska Public Lands Information Center, located inside the Morris Thompson Cultural & Visitors Center, in summer",https://www.nps.gov/common/uploads/structured_data/3C860F61-1DD8-B71B-0B4E7399BE80347C.jpg,9076443661,anch_web_mail@nps.gov
9,C08AD828-98FF-478E-A63C-614E7534274B,https://www.nps.gov/alca/index.htm,Alcatraz Island,alca,"Alcatraz reveals stories of American incarceration, justice, and our common humanity. This small island was once a fort, a military prison, and a maximum security federal penitentiary. In 1969, the Indians of All Tribes occupied Alcatraz for 19 months in the name of freedom and Native American civil rights. We invite you to explore Alcatraz's complex history and natural beauty.",37.82676234,-122.4230206,"lat:37.82676234, long:-122.4230206",CA,The Alcatraz Ferry Terminal is located on The Embarcadero near the intersection of Bay Street at Pier 33.,http://home.nps.gov/alca/planyourvisit/directions.htm,"The climate on Alcatraz is unpredictable and can change suddenly. Cold, foggy mornings may give way to sunny afternoons, which in turn can shift quickly back to more fog and blustery winds. The most pleasant weather usually occurs in spring and fall. Summers tend to be cool and foggy, winter is our rainy season. Temperatures on Alcatraz seldom rise above 75°F (24°C) or fall below 38°",Alcatraz Island,,1.0,94123,San Francisco,CA,US,,Alcatraz Island,Mailing,B201 Fort Mason,Golden Gate National Recreation Area,Darlyne Sheppard Alcatraz Photo Collection,"Serving the Christmas Meal, c 1951",Cook serving Christmas dinner with menu posted above.,"An inmate worker distributes trays near the steam table. Bars separate the kitchen from the mess hall.  The day’s menu, the Christmas meal, appears on a sign over his head. The menu includes consomme, stuffed celery, green olives and mixed sweet pickles,",https://www.nps.gov/common/uploads/structured_data/A64B4FF8-1DD8-B71B-0B63B232325C8081.jpg,415-561-4900,goga_alca_socialmedia@nps.gov
10,94B046DC-2AFD-4ECB-A60D-CE210A8550B1,https://www.nps.gov/aleu/index.htm,Aleutian Islands World War II National Historic Area,aleu,"During World War II the remote Aleutian Islands, home to the Unangax̂ (Aleut) people for over 8,000 years, became a fiercely contested battleground in the Pacific. This thousand-mile-long archipelago saw invasion by Japanese forces, the occupation of two islands; a mass relocation of Unangax̂ civilians; a 15-month air war; and one of the deadliest battles in the Pacific Theater.",53.9143,-166.5197,"lat:53.9143, long:-166.5197",AK,The park is located on Amaknak Island in the Aleutian Island chain. The island is located 800 miles west of Anchorage. The island can be reached by commercial or charter air flights from Anchorage. Commercial flights to Unalaska include Pen Air and Alaska Airlines. The Alaska Marine Highway is a ferry service that is operated by the state that can be used to reach the island. The Aleutian World War II Visitor Center is located at the Unalaska airport.,http://www.nps.gov/aleu/planyourvisit/directions.htm,"The Aleutian Islands are known for unpredictable and stormy weather. Rain, fog, and wind are common. Dress warmly and carry rain gear even in summer. Summer temperatures range from 45 to 65 degrees F. Early summer and fall often have clear sunny days with spectacular views of the surrounding volcanoes. See forecast: https://forecast.weather.gov/MapClick.php?lon=-166.52406692504883&lat=53.91748321582622#.X0aTYsi6OUk",Aleutian Islands World War II,National Historic Area,1.0,99501,Anchorage,AK,US,,"Affiliated Areas, Alaska Regional Office",Mailing,240 W 5th Avenue,National Park Service,Photo courtesy National Archives,Cultural collision,A uniformed man holds up a broken Russian cross,"The Aleutian campaign brought together Russian, Native Alaskan, Japanese, and Euroamerican cultures. During the war 7 historic churches were damaged or destroyed. Villages were unrecognizable or burned to the ground and personal belonging lost or stolen.",https://www.nps.gov/common/uploads/structured_data/3C7BC97B-1DD8-B71B-0B9A70C0C0988F0E.jpg,9076443472,rachel_mason@nps.gov
11,6D82D070-995A-4524-A56E-C1CE182E7D9B,https://www.nps.gov/alfl/index.htm,Alibates Flint Quarries National Monument,alfl,"13,000 years ago, Alibates was well-known by mammoth hunters as a source of flint for tools. The colorful flint has never lost its value or usefulness in the Texas Panhandle. Learn how important this site was to the survival, commerce, and culture of the people of the High Plains.",35.5819662,-101.6717008,"lat:35.5819662, long:-101.6717008",TX,"Alibates Flint Quarries is located approximately 35 miles north of Amarillo, Texas. From I-40 in Amarillo, take Lakeside exit north towards Lake Meredith National Recreation Area. Exit on TX 136 north towards Borger. After about 30 miles, turn west from TX 136 onto Cas Johnson Road. Park Service signs will be visible. Proceed approximately 3 miles to ""Y"" intersection and bear to right. Go northwest approximately 2 miles to the Alibates Flint Quarries National Monument Visitor Center.",http://www.nps.gov/alfl/planyourvisit/directions.htm,"The Texas Panhandle experiences a wide variety of weather conditions throughout the year. Winters are cold and windy, and summers are hot and dry. It is usually a good idea to bring a jacket with you if you are planning on hiking to the quarries with a ranger because the mesa gets very windy, even in the summer.",Alibates Flint Quarries,National Monument,1.0,79036,Fritch,TX,US,,P.O. Box 1460,Mailing,,,NPS Photo,Snowy Alibates,"A snowy mesa, as seen from the Alibates Visitor Center.",Every season hold special beauty at Alibates Flint Quarries National Monument.,https://www.nps.gov/common/uploads/structured_data/3C845BA9-1DD8-B71B-0B63C45334DC3128.jpg,8068576680,lamr_interpretation@nps.gov
12,3350C18C-8E07-487B-930E-37AD873D31AD,https://www.nps.gov/alpo/index.htm,Allegheny Portage Railroad National Historic Site,alpo,"The first railroad to cross the Allegheny Mountains, the Allegheny Portage Railroad was the final piece of the Pennsylvania Main Line Canal. ""The Portage"" opened in 1834, marking the first time that there was one, direct route between Philadelphia and Pittsburgh. All things to all people, it served merchants, passengers, slaves in pursuit of freedom, and soldiers from the Mexican War.",40.42977467,-78.57431622,"lat:40.42977467, long:-78.57431622",PA,"The park is located just off U.S. Route 22 approximately 12 miles west of Altoona and 10 miles east of Ebensburg. Take the Gallitzin Exit and turn right, following the signs. Visitors prior to 1992 accessed the park in other ways, but the Gallitzin Exit of US Route 22 is the way to access the visitor center and historic area.",http://www.nps.gov/alpo/planyourvisit/directions.htm,"The park is located in Cambria County, PA, and is at the summit of the Allegheny Mountains. Therefore, the park often takes on winter extremes. If planning on traveling from a long distance, please contact the park beforehand to ensure that the facilities are open. Please consult weather forecasts to ensure conditions are safe to travel in. Spring, summer, and fall are generally uneventful, but severe thunderstorms can occur.",Allegheny Portage Railroad,National Historic Site,1.0,16641,Gallitzin,PA,US,,110 Federal Park Road,Mailing,,,NPS,Barrels and crates in the Visitor Center show items that traveled on the Main Line Canal.,Barrel,Barrels and crates in the Visitor Center show items that traveled on the Main Line Canal.,https://www.nps.gov/common/uploads/structured_data/BE77D3FE-FB8B-3D66-D82497CBCD748596.jpeg,8148866150,alpo_interpretation@nps.gov
13,D35004EF-5F5A-4DA4-8716-5141BE5C933C,https://www.nps.gov/amch/index.htm,Amache National Historic Site,amch,"Amache, also known as the Granada Relocation Center, near Granada, Colorado was one of ten incarceration sites established by the War Relocation Authority during World War II to unjustly incarcerate Japanese Americans. Over 10,000 people, most American citizens, were incarcerated at Amache from 1942-1945. Amache - a place to reflect, recommit, and further the pursuit of freedom and justice.",38.04962,-102.32903,"lat:38.04962, long:-102.32903",CO,"Amache National Historic Site is in southeastern Colorado about 1.5 miles west of the town of Granada, 17.5 miles east of Lamar, and half an hour drive from the Kansas border. The site is located off Highway 385/50 along the Santa Fe Trail.",https://www.nps.gov/amch/planyourvisit/directions.htm,"The site is located in Colorado on the High Plains, an arid, windy, and sunny environment. Temperatures and conditions can be extreme in this region, with hot, arid summers that include occasional thunderstorms and tornadoes, as well as cold and snowy winters.",Amache,National Historic Site,1.0,81041,Granada,CO,US,,Amache National Historic Site,Mailing,,PO Box 44,NPS Photo / Stuart West,Amache Barracks and Guard Tower,"reconstructed barracks, guard and water towers surrounded by brown grass and shrubs.","Reconstructed barracks, guard and water towers at the newly designated Amache National Historic Site",https://www.nps.gov/common/uploads/structured_data/C1E570C9-C140-0E81-EDDC02810B0B7EAE.jpg,,Amache_visitor_information@nps.gov
14,A0B4CA5E-608A-4DF2-8EFB-E2E4619EA243,https://www.nps.gov/amme/index.htm,American Memorial Park,amme,"American Memorial Park honors the American and Marianas people who gave their lives during the Marianas Campaign of World War II. At the park, memorials stand in tribute to the courage and sacrifice of the US Servicemen and Chamorro and Carolinian civilians who were killed in the battles between the United States and Japan that took place on Saipan, Tinian, and the Philippine Sea in 1944.",15.21680033,145.7231096,"lat:15.21680033, long:145.7231096",MP,"The park is centrally located along the western shoreline of Saipan, adjacent to downtown Garapan. From airport, proceed north on Airport Road (Tun Herman Pan Highway) until the road ends at Monsignor Guerrero Road (Highway 16). Turn left and continue until the road ends at Beach Road. Turn right until the road ends at the American Memorial Park Mall. Turn left onto Micro Beach Road. The parking lot is on the right.",https://www.nps.gov/amme/planyourvisit/directions.htm,"The temperature varies from 75°F to 88°F and is rarely below 73°F or above 90°F.The climate is tropical, hot and humid throughout the year, with a relatively cool and dry season from December to June, and a warmer and rainy season from July to November. The temperatures are stable throughout the year.",American Memorial,Park,1.0,96950,Saipan,MP,US,,P.O. Box 5198,Mailing,Garapan,,NPS photo,The beach at American Memorial Park.,Crystal clear blue swimming at the park.,The beach is an inviting place to swim and relax.,https://www.nps.gov/common/uploads/structured_data/3C857C50-1DD8-B71B-0B272D30762B414D.jpg,6702347207,brooke_nevitt@nps.gov
