,id,url,fullName,parkCode,description,latitude,longitude,latLong,states,directionsInfo,directionsUrl,weatherInfo,name,designation,relevanceScore,address_postalCode,address_city,address_stateCode,address_countryCode,address_provinceTerritoryCode,address_line1,address_type,address_line3,address_line2,images_credit,images_title,images_altText,images_caption,images_url,park_phoneNumber,park_emailAddress
250,AA1E3B48-8B98-4F47-A642-C266A92AB523,https://www.nps.gov/kemo/index.htm,Kennesaw Mountain National Battlefield Park,kemo,"Kennesaw Mountain National Battlefield Park is a 2,965 acre National Battlefield that preserves a Civil War battleground of the Atlanta Campaign. Opposing forces maneuvered and fought here from June 19, 1864 until July 2, 1864. Although most famous as a Civil War battlefield, Kennesaw Mountain has a much richer story.",33.95370717,-84.59214186,"lat:33.95370717, long:-84.59214186",GA,"Kennesaw Mountain NBP is fairly spread out with multiple parking lots. Many visitors begin their visit at the Visitor Center located at 900 Kennesaw Mountain Dr. and orient themselves to the park with Ranger or Volunteer. For more detailed directions, please see link below.",http://www.nps.gov/kemo/planyourvisit/directions.htm,"Before you start your trip to the mountain, check the local weather forecast to be sure that you will have a dry time. Though we are located north of Atlanta, we're still have the same hot summers and mild winters as our neighbors. The mountain top generally ranges 8-10 degrees cooler than at the base. In fall and winter, be prepared with a light weight jacket on hand. After planning your activities, check back to see what the weather will have in store for your day.",Kennesaw Mountain,National Battlefield Park,1.0,30152,Kennesaw,GA,US,,900 Kennesaw Mountain Dr,Mailing,,,NPS Photo,Kolb Farmhouse at Kennesaw Mountain,Kolb Farmhouse at Kennesaw Mountain.,Kolb Farmhouse at Kennesaw Mountain.,https://www.nps.gov/common/uploads/structured_data/D0D81A83-1DD8-B71B-0B746691E9EEC035.jpg,770-427-4686,kemo_administration@nps.gov
251,E25D6277-11D8-425F-8498-718C98B13854,https://www.nps.gov/kewe/index.htm,Keweenaw National Historical Park,kewe,"From 7,000 years ago to the 1900s people mined Keweenaw copper. Native peoples made copper into tools and trade items. Investors and immigrants arrived in the 1800s in a great mineral rush, developing thriving industries and cosmopolitan communities. Though the mines have since closed, their mark is still visible on the land and people.",47.1792308,-88.52275344,"lat:47.1792308, long:-88.52275344",MI,"Keweenaw National Historical Park is located is located on the Keweenaw Peninsula, the northernmost part of Upper Michigan.",http://www.nps.gov/kewe/planyourvisit/directions.htm,"Summer: Keweenaw summers are usually mild, with average highs in the 70s, but can reach into the 80s and 90s. Nighttime temperatures are typically cool, but can also dip into the 40s or stay in the 70s. Summer months are dry, with occasional rain or severe thunderstorms. Winter: Again influenced by Lake Superior, winter temperatures are mild with highs in the 20s. Cold spells can occur with subzero temperatures. Lake effect snow is common, and 300 inches of snow can fall in a season.",Keweenaw,National Historical Park,1.0,49913,Calumet,MI,US,,25970 Red Jacket Road,Mailing,,,NPS Photo,Quincy Mining Company Smelter,"With a colorful autumn background, numerous industrial buildings sit on the waterfront",The Quincy Smelter is one of the best-preserved copper smelting facilities of its era.,https://www.nps.gov/common/uploads/structured_data/3C7D20D1-1DD8-B71B-0B292351051EE295.jpg,9063373168,kewe_information@nps.gov
252,C7C40543-5879-48FC-8E55-C26F3E0B4CCD,https://www.nps.gov/kimo/index.htm,Kings Mountain National Military Park,kimo,"Thomas Jefferson called it ""The turn of the tide of success."" The battle of Kings Mountain, fought October 7th, 1780, was an important American victory during the Revolutionary War. The battle was the first major patriot victory to occur after the British invasion of Charleston, SC in May 1780. The park preserves the site of this important battle.",35.13900723,-81.38978712,"lat:35.13900723, long:-81.38978712",SC,"Kings Mountain National Military Park is located on South Carolina Highway 216. From Greenville, SC travel on I-85 North to NC Exit #2. Turn right onto Hwy 216. From Charlotte, NC travel on I- 85 South to NC Exit #2. Turn left onto Hwy 216.",http://www.nps.gov/kimo/planyourvisit/directions.htm,Temperatures for the area range from very hot and humid in the summer to cool and moderate in the winter.,Kings Mountain,National Military Park,1.0,29702,Blacksburg,SC,US,,2625 Park Road,Mailing,,,Joe Epley for NPS,Militia Marching with Arms,Militia reenactors march with weapons on their shoulders as they prepare to demonstrate them.,Militia reenactors march with weapons on their shoulders as they prepare to give a firing demonstration.,https://www.nps.gov/common/uploads/structured_data/3C869124-1DD8-B71B-0B0A68C8BB1D9646.jpg,8649367921,KIMO_Information@nps.gov
253,0529BC85-CD42-4DA9-AC60-CAD7C40C3525,https://www.nps.gov/klse/index.htm,Klondike Gold Rush - Seattle Unit National Historical Park,klse,"Seattle flourished during and after the Klondike Gold Rush. Merchants supplied people from around the world passing through this port city on their way to a remarkable adventure in the Yukon Territory of Canada. Today, the park is your gateway to learn about the Klondike Gold Rush, explore the area's public lands, and engage with the local community.",47.5993663,-122.3319664,"lat:47.5993663, long:-122.3319664",WA,The park and visitor center are located on the northwest corner of 2nd Ave South and South Jackson Street in the former Cadillac Hotel. The Pioneer Square neighborhood is serviced by several public transportation options. Visit your directions page for more information about parking.,http://www.nps.gov/klse/planyourvisit/directions.htm,"Warm dry summers from mid-July through mid-Sept, all the rest of the year, mainly rainy and cool.",Klondike Gold Rush - Seattle Unit,National Historical Park,1.0,98104,Seattle,WA,US,,319 Second Ave S.,Mailing,,,NPS Photo,Big Wheel of Fortune,Big wheel to find your fortune,Spin the big wheel and see if you would have struck it rich.,https://www.nps.gov/common/uploads/structured_data/3C796B8C-1DD8-B71B-0BA402D548F12919.jpg,2062204240,klse_ranger_activities@nps.gov
254,5D4AA834-B601-44A8-B786-FF3306BA8A39,https://www.nps.gov/klgo/index.htm,Klondike Gold Rush National Historical Park,klgo,"Headlines screamed ""Gold!"" The dream of a better life catapulted thousands of people to Alaska and the Yukon Territory. Their journey shaped them, and changed the people they encountered and the north forever. Today, the park remembers the trails, boomtowns, and stories of the Klondike Gold Rush.",59.61042373,-135.2618535,"lat:59.61042373, long:-135.2618535",AK,"Park headquarters and visitor center are located at 2nd and Broadway in Skagway, Alaska. To get to Skagway by car: you can access the park via the Alaska Marine Highway or the South Klondike Highway. By plane: you can fly into the Skagway Airport. By water: You can visit the park by cruise ship, tour boat, or ferry. The park visitor center is less than half a mile from all docks.",http://www.nps.gov/klgo/planyourvisit/directions.htm,Skagway has a highly variable climate with frequent rain and high winds. Average temperatures May through September range from 47 F to 60 F. Average temperatures October through April range from 28 F to 38 F.,Klondike Gold Rush,National Historical Park,1.0,99840,Skagway,AK,US,,Klondike Gold Rush National Historical Park,Mailing,,P.O. Box 517,NPS photo/K. Pontius,Captain William Moore Cabin,Group of people gathered around a log cabin with a ranger,"The first building in Skagway was built in 1887, ten years before the Klondike gold rush.",https://www.nps.gov/common/uploads/structured_data/3C7BBD15-1DD8-B71B-0BEC60828B881F61.jpg,9079839200,klgo_information@nps.gov
255,0103833B-8114-4483-9754-11B5171BCB20,https://www.nps.gov/knri/index.htm,Knife River Indian Villages National Historic Site,knri,"Earthlodge people hunted bison and other game, but were in essence farmers living in villages along the Missouri and its tributaries. The site was a major Native American trade center for hundreds of years prior to becoming an important market place for fur traders after 1750.",47.3540219,-101.3860533,"lat:47.3540219, long:-101.3860533",ND,"Plane Fly into Bismarck or Minot, ND. Hazen, ND (15 miles from site) has an airport for small planes. Car One-half mile north of Stanton, ND on County Road 37. One hour northwest of Bismarck, ND and one and a half hours southwest of Minot, ND. Public Transportation Charter and tour bus parking available at Visitor Center parking lot.",http://www.nps.gov/knri/planyourvisit/directions.htm,"Summers are warm and sunny with temperatures occasionally reaching 100 degrees F and frequent afternoon thunderstorms. Winters are invigorating, with extremely cold temperatures as low as -35 degrees F. High winds and sunny skies are common in winter. Snow is sporadic in the relatively dry climate, but blizzards are common.",Knife River Indian Villages,National Historic Site,1.0,58571,Stanton,ND,US,,P.O. Box 9,Mailing,,,NPS Photo,Sakakawea Village,Sakakawea Village,Sakakawea Village,https://www.nps.gov/common/uploads/structured_data/3C81440A-1DD8-B71B-0B07E8FB404C1563.jpg,7017453300,KNRI_Information@nps.gov
256,691831BF-F280-4E02-BF4A-FF476BC66B23,https://www.nps.gov/kova/index.htm,Kobuk Valley National Park,kova,"Caribou, sand dunes, the Kobuk River, Onion Portage - just some of the facets of Kobuk Valley National Park. Thousands of caribou migrate through, their tracks crisscrossing sculpted dunes. The Kobuk River is an ancient and current corridor for people and wildlife. For 9000 years, people came to Onion Portage to harvest caribou as they swam the river. Even today, that rich tradition continues.",67.35631336,-159.2002293,"lat:67.35631336, long:-159.2002293",AK,"Kobuk Valley National Park is very remote. There are no roads to provide access, so planes take care of most transportation needs. Commercial airlines provide service from Anchorage to Kotzebue, or from Fairbanks to Bettles. Once in Kotzebue or Bettles, you must fly to the park with authorized air taxis.",http://www.nps.gov/kova/planyourvisit/directions.htm,"Snow, rain, and freezing temperatures can occur any time of the year. Always travel with good quality rain gear and warm layers. Be especially careful to stay dry. Hypothermia can set in on a windy, wet day, even when it doesn't feel that cold.",Kobuk Valley,National Park,1.0,99752,Kotzebue,AK,US,,PO Box 1029,Mailing,,,NPS Photo,Kobuk Locoweed,pink flower growing in sand,Oxytropis kobukensis (Kobuk Locoweed) is a member of the pea family and adds a splash of pink to the sand dunes. The blossoms have that typical pea/ bean flower shape that many gardeners know.,https://www.nps.gov/common/uploads/structured_data/3C7A168D-1DD8-B71B-0B5167863DD39B57.jpg,9074423890,wear_webmail@nps.gov
257,0DEA542F-01B7-4631-8AAD-124161D7B7E6,https://www.nps.gov/kowa/index.htm,Korean War Veterans Memorial,kowa,"At the Korean War Veterans Memorial, ""Our nation honors her sons and daughters who answered the call to defend a country they never knew and a people they never met.""",38.88784226,-77.04773857,"lat:38.88784226, long:-77.04773857",DC,"GPS Coordinates: 38.887778, -77.047660 Address: 10 Daniel French Dr, SW, Washington, D.C. Nearest Intersection: Independence Ave. & Daniel Chester French Dr. SW",http://www.nps.gov/kowa/planyourvisit/directions.htm,Washington DC gets to see all four seasons. Humidity will make the temps feel hotter in summer and colder in winter. Spring (March - May) Temp: Average high is 65.5 degrees with a low of 46.5 degrees Summer (June - August) Temp: Average high is 86 degrees with a low of 68.5 degrees Fall (September - November) Temp: Average high is 68 degrees with a low of 51.5 degrees Winter (December - February) Temp: Average high is 45 degrees with a low of 30 degrees (Source: www.usclimatedata.com),Korean War Veterans Memorial,,1.0,20242,Washington,DC,US,,1100 Ohio Drive SW,Mailing,,,NPS/RMendoza,Freedom Is Not Free,Nineteen stainless steel statues reflect on a black granite wall,The nineteen statues reflect on the black granite wall creating an illusion of thirty-eight soldiers. The number thirty-eight represents the 38th parallel latitude where the Korean borders are located.,https://www.nps.gov/common/uploads/structured_data/F0DCE2DE-CB5C-1B53-2DAD37F5B10D68A6.jpg,2024266841,national_mall@nps.gov
258,D50B95B0-11C7-4F0A-8B3A-9BAC66E8F1A7,https://www.nps.gov/lyba/index.htm,LBJ Memorial Grove on the Potomac,lyba,"From this distance the seat of national power appears pristine across the river, so President Johnson came here often when he needed to escape from the stresses of building a Great Society. After he died, his wife chose this place for his memorial. A landscape of serpentine paths, white pines, a granite monolith, and an open meadow honors his legacy of social justice and conservation legislation.",38.87858036,-77.05145832,"lat:38.87858036, long:-77.05145832",DC,"From the southbound lanes of the George Washington Memorial Parkway, follow the sign to turn right to enter the parking lot. This entrance to the park can only be reached from the southbound lanes of the parkway.",http://www.nps.gov/lyba/planyourvisit/directions.htm,"Summers in the park are generally hot and humid, with daytime highs frequently above 90 degrees Fahrenheit and scattered afternoon thunderstorms. Please carry water while participating in physical activity and be prepared to take shelter from lightning. Winters in the park are generally cold, with nighttime lows frequently near freezing and occasional snowfall. Please be alert for snowplows and icy spots on roadways. Weather during spring and fall is generally moderate, but can change quickly.",LBJ Memorial Grove on the Potomac,,1.0,22101,McLean,VA,US,,Lyndon Baines Johnson Memorial Grove,Mailing,George Washington Memorial Parkway,c/o Turkey Run Park,NPS,Daffodils near the LBJ Memorial,View from the the LBJ memorial of numerous daffodils and the Potomac River.,View of the Memorial Bridge and Potomac River from near the LBJ Memorial Grove.,https://www.nps.gov/common/uploads/structured_data/F3851DED-9D59-A669-4716CCBE27BC5657.jpg,7032351530,gwmp_superintendent@nps.gov
259,5F76F85B-23F4-4616-AA0B-A26E8DE76593,https://www.nps.gov/lacl/index.htm,Lake Clark National Park & Preserve,lacl,"Lake Clark National Park and Preserve is a land of stunning beauty. Volcanoes steam, salmon run, bears forage, and craggy mountains reflect in shimmering turquoise lakes. Here, too, local people and culture still depend on the land and water. Venture into the park to become part of the wilderness.",60.57405857,-153.55535,"lat:60.57405857, long:-153.55535",AK,"Lake Clark is located on the Alaska Peninsula southwest of Anchorage and north of Katmai National Park. It is not on the road system; therefore, in order to get here you must travel either via plane or by boat. A one to two-hour flight from Anchorage, Kenai, or Homer will provide access to most points within Lake Clark. Fixed-wing aircraft are allowed to land on all suitable lakes, rivers, beaches, gravel bars, and open ground in both the park and preserve unless the area is closed or otherwise restricted.",http://www.nps.gov/lacl/planyourvisit/directions.htm,"Lake Clark has two distinct climate areas: the coast and the interior. The coast is wetter and experiences milder temperatures. The interior gets half to one fourth as much precipitation, but temperatures are hotter in summer and colder in winter. Frost and snow can occur any time parkwide, but are most common from September to early June. Lakes here typically begins freezing in November and melting in April. Ice conditions dictate whether planes need floats or skis to land on lakes.",Lake Clark,National Park & Preserve,1.0,99501,Anchorage,AK,US,,240 West 5th Avenue,Mailing,,Suite 236,NPS Photo / Kent Miller,Richard L. Proenneke National Historic Site,"Photo of a one story log cabin, cache, forest, and American flag reflecting in a calm, blue lake.",The park protects and interprets the Richard L. Proenneke National Historic Site and trail complex as a symbol of the national wilderness movement and a source of inspiration and solace sought out by visitors from throughout the world.,https://www.nps.gov/common/uploads/structured_data/3C7AA314-1DD8-B71B-0B5E93E5AD68E6D5.jpg,9076443626,lacl_visitor_information@nps.gov
260,7B43EA5B-298C-4BAB-B22D-860B852B40A5,https://www.nps.gov/lake/index.htm,Lake Mead National Recreation Area,lake,"Swim, boat, hike, cycle, camp and fish at America’s first and largest national recreation area. With striking landscapes and brilliant blue waters, this year-round playground spreads across 1.5 million acres of mountains, canyons, valleys and two vast lakes. See the Hoover Dam from the waters of Lake Mead or Lake Mohave, or find solitude in one of the park's nine wilderness areas.",35.96622528,-114.3469067,"lat:35.96622528, long:-114.3469067","AZ,NV","By car you can drive to one of the park's many entrances. The six main entrances to Lake Mead are as follows: Northshore, Lake Mead Boulevard, Lake Mead Parkway, and Boulder, Temple Bar and Meadview. For the southern sections of the park, near Lake Mohave, there are entrance stations at Willow Beach, Katherine Landing and Cottonwood Cove.",http://www.nps.gov/lake/planyourvisit/directions.htm,"Spring (April, May and June): Daytime highs 80 °F to 98 °F. Nighttime lows 50 °F to 66 °F Summer* (July, August and September): Daytime highs 89 °F to 103 °F (It can get up to 117 °F.) Fall (October, November and December): Daytime highs 59 °F to 83 °F. Nighttime lows 32 °F to 50 °F. Winter (January, February and March) Daytime highs 57 °F to 69 °F. Nighttime lows 30 °F to 40 °F. *Summer can be a dangerous time due to excessive heat. Some trails are closed for public safety.",Lake Mead,National Recreation Area,1.0,89005,Boulder City,NV,US,,601 Nevada Way,Mailing,,,NPS Photo/Andrew Cattoir,Bighorn Sheep Enjoying the View at Lake Mead NRA,A group of bighorn sheep overlooking Lake Mead.,With wilderness comes wildlife. Bighorn sheep can be spotted at most areas of the park.,https://www.nps.gov/common/uploads/structured_data/3C79D824-1DD8-B71B-0BF17A042C954AA2.jpg,7022938990,LAKE_information@nps.gov
261,AC3B46AA-B4C2-4555-A82A-D4CF790DF81D,https://www.nps.gov/lamr/index.htm,Lake Meredith National Recreation Area,lamr,"Within the dry plains of the Texas Panhandle lies a hidden oasis, a haven where wildlife and people can find relief from the dry grasslands above. Through this plain, the Canadian River has cut dramatic 200-foot canyons, or breaks, where humans lived many years ago. Lake Meredith occupies these hidden coves and provides 7 different habitats for migratory birds and other wildlife.",35.61926203,-101.6820066,"lat:35.61926203, long:-101.6820066",TX,"There are several ways to arrive at Lake Meredith. If you are coming from Amarillo, exit Loop 335 North, then exit Hwy 136 North to Fritch, Texas. Headquarters is located at 419 E. Broadway in Fritch. If coming from the North, take FM 1913 from the Dumas Highway or FM 1913 from US 287. The Amarillo Airport is approximately 35 miles south of Lake Meredith, if traveling by air. Rental cars are available in Amarillo.",http://www.nps.gov/lamr/planyourvisit/directions.htm,"This area of the Texas Panhandle has a wide variety of weather conditions throughout the year. Winters are cold and windy, with summers being hot and dry. Weather can change rapidly on Lake Meredith. It is usually a good idea to check the weather report and dress accordingly.",Lake Meredith,National Recreation Area,1.0,79036,Fritch,TX,US,,Lake Meredith National Recreation Area,Mailing,,P.O. Box 1460,NPS Photo,Wildlife,Twoi baby mule deer,Two Mule Deer,https://www.nps.gov/common/uploads/structured_data/AEABFBA5-0408-14A8-2BEE771262F9D42D.jpg,806 857-3151,lamr_interpretation@nps.gov
262,B548FF88-8155-4E56-8E77-FB140D06E1EC,https://www.nps.gov/laro/index.htm,Lake Roosevelt National Recreation Area,laro,"The ancient geologic landscape of the upper Columbia River cradles Lake Roosevelt in walls of stone carved by massive ice age floods. Come explore the shorelines and learn the stories of American Indians, traders and trappers, settlers and dam builders who called this place home. Swim, boat, hike, camp, and fish at this hidden gem in Northeast Washington, created by the Grand Coulee Dam.",48.17148735,-118.3513713,"lat:48.17148735, long:-118.3513713",WA,"From Spokane Take I-90 West. At Exit 277, merge onto US-2 toward Davenport/Fairchild AFB/Spokane Airport. Just past Wilbur, turn right onto WA-21. Stay left onto Highway 174. Turn right onto WA-155. Stay on WA-155 past Grand Coulee Dam and into the town of Coulee Dam. Cross the Columbia River and continue on WA-155. Turn right onto Crest Drive and follow up the hill. The Headquarters Office is located on the left.",http://www.nps.gov/laro/planyourvisit/directions.htm,"Lake Roosevelt is generally a cool or cold place from fall through spring with overcast skies. In the summer, the skies clear and present warm to hot days.",Lake Roosevelt,National Recreation Area,1.0,99116,Coulee Dam,WA,US,,Lake Roosevelt National Recreation Area,Mailing,,1008 Crest Drive,NPS/Cadwell,Lake Roosevelt 4,Snow falls over a small peninsula with its clear reflection over the waters.,Snow falls over a small peninsula with its clear reflection over the waters.,https://www.nps.gov/common/uploads/structured_data/3C8791E4-1DD8-B71B-0B5B84AE35F46BB8.jpg,509-754-7800,laro_web_master@nps.gov
263,9AA4A53C-0331-43CC-99F5-379BC929FFB2,https://www.nps.gov/lavo/index.htm,Lassen Volcanic National Park,lavo,"Lassen Volcanic National Park is home to steaming fumaroles, meadows freckled with wildflowers, clear mountain lakes, and numerous volcanoes. Jagged peaks tell the story of its eruptive past while hot water continues to shape the land.",40.49354575,-121.4075993,"lat:40.49354575, long:-121.4075993",CA,"From Interstate 5 (Redding), take Hwy 44 - 48 miles east to the junction of Hwy 89. Follow Hwy 89 south 1 mile to the north entrance of the park. From Interstate 5 (Red Bluff) take Hwy 36 E - 51 miles east to the junction of Hwy 89. Follow Hwy 89 north 6 miles to south entrance of the park.",http://www.nps.gov/lavo/planyourvisit/directions.htm,"Weather at Lassen can vary dramatically throughout the year. Average January temperatures are a high of 40.4 °F (4.7 °C) and a low of 20.8 °F (-6.2 °C). Average July temperatures are a high of 88.4 °F and a low of 49.8 °F. Temperatures reach 90 °F or higher on an average of 36.9 days, and drop to 32 ° or lower on an average of 164 days days annually.",Lassen Volcanic,National Park,1.0,96063,Mineral,CA,US,,PO Box 100,Mailing,,,NPS Photo / B.F. Loomis,Lassen Peak Eruption,An ash cloud rises above a volcano with an early 19th century vehicle at the forefront.,"A large, explosive eruption of Lassen Peak brought national attention and set the stage for the establishment of Lassen Peak.",https://www.nps.gov/common/uploads/structured_data/3C8743DC-1DD8-B71B-0B1DE16014F1A63F.jpg,5305954480,lavo_information@nps.gov
264,10AEFADA-AFA0-4998-A9E5-3F504F351AAB,https://www.nps.gov/labe/index.htm,Lava Beds National Monument,labe,"Lava Beds National Monument is a land of turmoil, both geological and historical. Over the last half-million years, volcanic eruptions on the Medicine Lake shield volcano have created a rugged landscape dotted with diverse volcanic features. More than 800 caves, Native American rock art sites, historic battlefields and campsites, and a high desert wilderness experience await you!",41.75915823,-121.5172189,"lat:41.75915823, long:-121.5172189",CA,"Lava Beds is a truly remote park, in a corner of California most people never visit. Most roads into this area wind through mountains, and along rivers, and travel may take longer than expected. Services are few and far between and winter driving conditions can be encountered anytime between fall and spring.",http://www.nps.gov/labe/planyourvisit/directions.htm,"Park elevations range from 4,000 to 5,700 feet. Cold weather is possible any time of year, and snow has been recorded in all months. Winter day­time highs average 40°F; lows average 20°F. Morning fog is frequent from autumn through spring. Summer daytime highs average 75° to 80°F; lows average 50°F. Occasional thunderstorms occur in summer.",Lava Beds,National Monument,1.0,96134,Tulelake,CA,US,,P.O. Box 1240,Mailing,,,NPS Photo / Jesse Barden,Snowy Sunrise,snowy sunrise at Hopkins Chocolate Cave,Snowy sunrise at Hopkins Chocolate Cave,https://www.nps.gov/common/uploads/structured_data/3C820AFA-1DD8-B71B-0B0C81AAC1788FC2.jpg,5306678113,LABE_Information@nps.gov
